{
  "business": {
    "name": "",
    "type": "",
    "timezone": "Europe/Madrid",
    "locale": "es-ES"
  },
  "branding": {
    "primaryColor": "#4f46e5",
    "formTitle": "Registro",
    "formSubtitle": "",
    "welcomeEmailSubject": "¡Bienvenido/a!"
  },
  "form": {
    "fields": {
      "telefono": { "required": false },
      "fecha_nacimiento": { "required": true }
    },
    "memberships": ["Mensual", "Trimestral", "Anual"],
    "goals": ["Perder peso", "Ganar músculo", "Recomposición corporal", "Otro"]
  },
  "n8n": {
    "webhookPath": "onboarding",
    "notionDatabaseId": "",
    "telegramChatId": "",
    "fromEmail": ""
  },
  "contact": {
    "email": "",
    "phone": "",
    "schedule": {
      "weekdays": "",
      "saturday": "",
      "sunday": ""
    }
  }
}
